{
  "source_skill": "risk-analysis",
  "phase": "risk-analysis",
  "artifacts": [
    {
      "type": "RiskItemList",
      "schema_ref": "schemas/risk-item.schema.json",
      "items": [
        {
          "id": "RISK-007",
          "statement": "再送制御の不備により決済が重複し、STK-001 が二重請求の不利益を受ける",
          "category": "product",
          "likelihood": "medium",
          "impact": "critical",
          "affected_stakeholder_refs": [
            "STK-001"
          ],
          "requirement_refs": [
            "REQ-012"
          ],
          "treatment": "mitigate",
          "residual_risk": "決済事業者の応答喪失時には手動照合が必要となる"
        }
      ]
    }
  ],
  "trace_ids": [
    "REQ-012",
    "RISK-007"
  ],
  "assumptions": [
    {
      "field": "likelihood",
      "value": "medium",
      "reason": "本番障害履歴が未提供のため、設計上の発生可能性から暫定評価した"
    }
  ],
  "open_questions": [
    "決済事業者側の冪等性保証範囲を確認する"
  ],
  "gate_status": "passed-with-risks"
}
